"name"", ""description"", ""done"", ""rating"", ""prep_time"
Strawberry Cupcakes,Strawberry cupcakes with real fresh strawberry bits!,false, 4 stars,
Strawberry Cupcakes,Strawberry cupcakes with real fresh strawberry bits!,false, 4 stars,
Fig Jam,A spiced fig jam to serve on toast for breakfast or to upgrade your next PB&J. The jam will keep in the refrigerator for about 2 weeks.,false,,
1-Step Chipotle Hummus,Add a smoky kick to ordinary hummus with this quick and easy recipe.,false,,
ha,he,false,3,
camila,very camila,false,5,
Shaker Lemon Pie,"This is a very tart lemon pie using whole lemons (rind and all), sliced paper thin. It's for the TRUE lemon lover!",true, 4 stars,
